{
  "id": "8f52205be55189c0",
  "annotation_version": "2.0",
  "image_path": "data/processed/multimodal/images/03-10/pages/page_0001.png",
  "json_path": "data/processed/multimodal/annotations/03-10/pages/page_0001.json",
  "source_pdf": "03.10.pdf",
  "page_number": 1,
  "page_type": "chart",
  "page_type_confidence": 0.5,
  "summary": "chart | timeframes: H1, M15 | concepts: risk_management | 03.10.2024 Montag, 7.",
  "embedded_text": "03.10.2024\n\nMontag, 7. Oktober 2024\n21:41\n\nIm H1 waren wir heute Bearisch\n\nIm M15 gab es heute kein Setup\n\nOktober Seite 1",
  "ocr_text": "03.10.2024\nIm H1 waren wir heute Bearisch\nI ! 200\n61.950,00\nofl wily i\nny | | noms 61.550,00\ni >\n! | Al\n° 60.000,00\n59.720,00\nSN NN NA\n= TradingView\nIm M15 gab es heute kein Setup\neen vy elrize genes\ni : 62.750,00\n[\n| \\ 62.250,00\n|\nA pad fi 61.850,00\nFi of | A TE 61.450,00\ni 60.350,00\n| m=\n® 59.750,00\n59.500,00\n59.220,00\nRR | 58.080,00\n0 12:00 18:00 z 06:00 12:00 18:00 3 06:00 12:00 18:00 4\nOktober Seite 1\n03.10.2024\nIm H1 waren wir heute Bearisch",
  "combined_text": "03.10.2024\nMontag, 7. Oktober 2024\n21:41\nIm H1 waren wir heute Bearisch\nIm M15 gab es heute kein Setup\nOktober Seite 1\nI ! 200\n61.950,00\nofl wily i\nny | | noms 61.550,00\ni >\n! | Al\n° 60.000,00\n59.720,00\nSN NN NA\n= TradingView\neen vy elrize genes\ni : 62.750,00\n[\n| \\ 62.250,00\n|\nA pad fi 61.850,00\nFi of | A TE 61.450,00\ni 60.350,00\n| m=\n® 59.750,00\n59.500,00\n59.220,00\nRR | 58.080,00\n0 12:00 18:00 z 06:00 12:00 18:00 3 06:00 12:00 18:00 4",
  "extraction_methods": [
    "embedded_text",
    "ocr"
  ],
  "ocr_metadata": {
    "enabled": true,
    "available": true,
    "status": "ok",
    "language": "deu+eng",
    "command": "C:\\Program Files\\Tesseract-OCR\\tesseract.exe",
    "tessdata_prefix": "C:\\Users\\fynnw\\Desktop\\Datensatz-LLM-Training\\.tessdata"
  },
  "symbols": [],
  "timeframes": [
    "H1",
    "M15"
  ],
  "trading_concepts": [
    "risk_management"
  ],
  "trading_domains": [],
  "labels": {
    "has_embedded_text": true,
    "has_ocr_text": true,
    "text_density": "medium",
    "likely_chart": true,
    "contains_trade_levels": false,
    "contains_performance_metrics": false,
    "contains_strategy_rules": false,
    "contains_symbol": false,
    "contains_timeframe": true
  },
  "review_required": false,
  "asset_count": 2,
  "asset_ids": [
    "bfa424a51e53c515",
    "1d4c12926d9af539"
  ],
  "target_json": {
    "page_type": "chart",
    "summary": "chart | timeframes: H1, M15 | concepts: risk_management | 03.10.2024 Montag, 7.",
    "clean_text": "03.10.2024\nMontag, 7. Oktober 2024\n21:41\nIm H1 waren wir heute Bearisch\nIm M15 gab es heute kein Setup\nOktober Seite 1\nI ! 200\n61.950,00\nofl wily i\nny | | noms 61.550,00\ni >\n! | Al\n° 60.000,00\n59.720,00\nSN NN NA\n= TradingView\neen vy elrize genes\ni : 62.750,00\n[\n| \\ 62.250,00\n|\nA pad fi 61.850,00\nFi of | A TE 61.450,00\ni 60.350,00\n| m=\n® 59.750,00\n59.500,00\n59.220,00\nRR | 58.080,00\n0 12:00 18:00 z 06:00 12:00 18:00 3 06:00 12:00 18:00 4",
    "symbols": [],
    "timeframes": [
      "H1",
      "M15"
    ],
    "trading_concepts": [
      "risk_management"
    ],
    "trading_domains": [],
    "labels": {
      "has_embedded_text": true,
      "has_ocr_text": true,
      "text_density": "medium",
      "likely_chart": true,
      "contains_trade_levels": false,
      "contains_performance_metrics": false,
      "contains_strategy_rules": false,
      "contains_symbol": false,
      "contains_timeframe": true
    }
  }
}